{
	"$schema": "https://json-schema.org/draft-07/schema",
	"$id": "https://savoy-smash.pxslip.com/schemas/cocktail.schema.json",
	"title": "Cocktail",
	"description": "The ingredients, and directions required to make a cocktail",
	"type": "object",
	"properties": {
		"source": {
			"type": "string",
			"description": "Where did this cocktail originate from? Savoy Cocktail book, Trader Vic's, etc."
		},
		"version": {
			"type": "string",
			"description": "Which version of the cocktail is this? e.g. Original, mine, or a named creator"
		},
		"directions": {
			"type": "string",
			"description": "Instructions for making this version of the cocktail"
		},
		"ingredients": {
			"$comment": "Allow for a top level Ingredient object, or a nested array of ingredients for ingredients that offer options",
			"description": "A list of ingredients and amounts used in the cocktail",
			"type": "array",
			"items": [
				{
					"$ref": "#/definitions/Ingredient"
				},
				{
					"type": "array",
					"items": {
						"$ref": "#/definitions/Ingredient"
					}
				}
			]
		}
	},
	"definitions": {
		"Ingredient": {
			"description": "A reference to an ingredient that can be used in a cocktail",
			"type": "object",
			"properties": {
				"ingredient": {
					"type": "string",
					"$comment": "A path-style reference to an Ingredient"
				},
				"amount": {
					"type": "string"
				},
				"measurement": {
					"type": "string"
				}
			}
		}
	}
}
